{
  "intent_name": "extraction_and_trajectory_smoke",
  "intent_spec_version": "1.0.0",
  "evaluation_goal": "Evaluate email extraction and trajectory tool-use: extract email from text, and use search_email_db then answer.",
  "target_domain": ["extraction", "trajectory"],
  "capability_focus": ["extraction", "trajectory"],
  "batch_size": 6,
  "defaults": {
    "seed": 42,
    "max_prompt_length": 20000,
    "max_retries_per_stage": 2
  },
  "planner_defaults": {
    "prefer_deterministic_judge": true,
    "allow_experimental_families": false,
    "max_families": 10
  }
}
