{
  "intent_name": "hard_failure_seeking_reliability",
  "intent_spec_version": "1.0.0",
  "planner_objective": "failure_seeking",
  "difficulty_floor": "hard",
  "evaluation_goal": "Stress-test agent reliability with harder, failure-prone but still machine-checkable tasks across trajectory, grounded QA, extraction, classification, and math.",
  "target_domain": [
    "trajectory",
    "grounded_qa",
    "extraction",
    "classification",
    "math"
  ],
  "capability_focus": [
    "trajectory",
    "grounded_qa",
    "extraction",
    "classification",
    "math"
  ],
  "hard_min_fraction": 0.7,
  "adversarial_variation_required": true,
  "risk_focus": [
    "tool_use_correctness",
    "grounding_fidelity",
    "schema_adherence",
    "instruction_following"
  ],
  "difficulty_mix": {
    "medium": 0.2,
    "hard": 0.8
  },
  "batch_size": 12,
  "defaults": {
    "seed": 42,
    "max_prompt_length": 20000,
    "max_retries_per_stage": 2
  }
}
